{
  "meta": {
    "title": "The Life of Research Ideas",
    "subtitle": "An interactive map, 2020–2026",
    "description": "Research rarely moves in a straight line. This map shows the questions I pursued, the studies they became, where they stalled, and how earlier ideas returned in later work. Choose a research area or select any event to see what led to it and what came next.",
    "startYear": 2020,
    "endYear": 2026,
    "updated": "2026-09-23"
  },
  "threads": [
    {
      "id": "empathy",
      "label": "Empathy & social value",
      "shortLabel": "Empathy",
      "color": "#2f6f9f",
      "order": 0
    },
    {
      "id": "network",
      "label": "Networks & belonging",
      "shortLabel": "Networks",
      "color": "#3f7d5a",
      "order": 1
    },
    {
      "id": "morality",
      "label": "Moral disagreement",
      "shortLabel": "Morality",
      "color": "#b15f3e",
      "order": 2
    },
    {
      "id": "hybrid",
      "label": "Integrations",
      "shortLabel": "Hybrid",
      "color": "#715aa6",
      "order": 3
    },
    {
      "id": "cross",
      "label": "Cross-cutting questions",
      "shortLabel": "Cross",
      "color": "#68747c",
      "order": 4
    },
    {
      "id": "meta",
      "label": "Research formation",
      "shortLabel": "Meta",
      "color": "#a0782a",
      "order": 5
    }
  ],
  "nodes": [
    {
      "id": "X00",
      "title": "Research-question generation",
      "thread": "meta",
      "date": "2020-04-11",
      "endDate": "2020-05-08",
      "kind": "question",
      "status": "completed",
      "summary": "This early period involved broad reading and the development of several questions that later became multi-study projects."
    },
    {
      "id": "X01",
      "title": "Social inference from incomplete information",
      "thread": "cross",
      "date": "2020-04-21",
      "endDate": "2020-05-08",
      "kind": "question",
      "status": "persistent",
      "summary": "Across several projects, people use limited social information to form broader expectations about another person’s character, value, and relationships."
    },
    {
      "id": "E01",
      "title": "Empathy and social-value learning",
      "thread": "empathy",
      "date": "2020-05-08",
      "endDate": "2020-06-04",
      "kind": "question",
      "status": "completed",
      "summary": "This question asks whether another person’s good or bad outcomes can take on value for us through experience, rather than empathy being only a stable trait.",
      "question": "Can another person’s outcomes acquire value through experience?",
      "significance": "This seed turned empathy from a stable trait into a learnable relation between observer, target, and outcome."
    },
    {
      "id": "E02",
      "title": "Pavlovian conditioning of empathy",
      "thread": "empathy",
      "date": "2020-06-04",
      "endDate": "2021-04-23",
      "kind": "attempt",
      "status": "completed",
      "summary": "The first experiments tested whether basic associative learning could change how strongly people respond empathically to another person.",
      "question": "Could a basic associative mechanism explain changes in empathic response?",
      "significance": "The initial question became an experimental program with explicit learning predictions."
    },
    {
      "id": "E03",
      "title": "Empathy experimental paradigm",
      "thread": "empathy",
      "date": "2020-08-27",
      "endDate": "2021-02-05",
      "kind": "attempt",
      "status": "completed",
      "summary": "The study separated learning, empathy ratings, prosocial choices, and trait measures so that their roles could be examined independently.",
      "question": "How can learning, felt empathy, and later choice be separated?",
      "significance": "A staged paradigm made it possible to distinguish acquisition, evaluation, and action."
    },
    {
      "id": "E04",
      "title": "Abstract mental-state generalization",
      "thread": "empathy",
      "date": "2021-01-12",
      "endDate": "2022-09-22",
      "kind": "reframing",
      "status": "persistent",
      "summary": "The project shifted from asking whether learning occurred to asking what people learned and whether it could generalize from concrete cues to another person’s mental states.",
      "question": "What is represented when learning generalizes beyond a specific cue?",
      "significance": "The project moved from asking whether learning occurs to asking what kind of mental representation is learned."
    },
    {
      "id": "E05",
      "title": "Associative vs evaluative learning",
      "thread": "empathy",
      "date": "2021-04-23",
      "endDate": "2021-10-22",
      "kind": "reframing",
      "status": "completed",
      "summary": "The work compared associative and evaluative accounts of learning, clarifying the proposed mechanism without abandoning the broader learning explanation.",
      "question": "Is the mechanism best described as associative or evaluative learning?",
      "significance": "Clarifying the mechanism tightened the claim without abandoning the larger learning framework."
    },
    {
      "id": "E06",
      "title": "PIT and prosocial choice",
      "thread": "empathy",
      "date": "2021-10-22",
      "endDate": "2023-08-10",
      "kind": "attempt",
      "status": "completed",
      "summary": "Transfer and choice tasks tested whether learned value changed later prosocial decisions, not only participants’ ratings.",
      "question": "Does learned value transfer from ratings into prosocial choice?",
      "significance": "A transfer task tested whether the acquired representation could guide a new action."
    },
    {
      "id": "E07",
      "title": "Mental states versus general valence",
      "thread": "empathy",
      "date": "2022-06-03",
      "endDate": "2023-04-20",
      "kind": "pivot",
      "status": "completed",
      "summary": "New studies asked whether participants learned about another person’s preferences and mental states or simply learned that certain stimuli were positive.",
      "question": "Is the model learning a person’s state—or merely the positivity of a stimulus?",
      "significance": "This construct challenge forced the project to separate person-specific mental states from general valence.",
      "afterlifeSummary": "This shift led to a more precise account of how people learn another person’s preferences and welfare, and it clarified what the later studies needed to distinguish."
    },
    {
      "id": "E08",
      "title": "Preference and utility representation",
      "thread": "empathy",
      "date": "2022-09-29",
      "endDate": "2024-10-15",
      "kind": "reframing",
      "status": "persistent",
      "summary": "Another person’s preferences provided a measurable way to represent their welfare and test how much that welfare mattered in later choices.",
      "question": "Can preferences provide a tractable representation of another person’s welfare?",
      "significance": "Person-specific utility offered a more precise bridge between abstract mental states and observable choices."
    },
    {
      "id": "E09",
      "title": "Learning the value of others' welfare",
      "thread": "empathy",
      "date": "2023-07-20",
      "endDate": "2024-03-05",
      "kind": "reframing",
      "status": "completed",
      "summary": "The studies converged on a central account: experience can change the value people place on another person’s welfare.",
      "question": "How does the value of another person’s welfare become learned?",
      "significance": "Several studies converged on a manuscript-level contribution about the acquisition of social value."
    },
    {
      "id": "E10",
      "title": "Modality and awareness boundary conditions",
      "thread": "empathy",
      "date": "2023-04-20",
      "endDate": "2024-11-26",
      "kind": "setback",
      "status": "completed",
      "summary": "Changes in task format and in what participants could consciously report helped identify where the proposed learning process did and did not generalize.",
      "question": "Where does generalization stop?",
      "significance": "Boundary conditions became part of the theory, not merely caveats around it.",
      "afterlifeSummary": "The transfers that did not work helped define the limits of the claim. Those limits became part of the final published account rather than being discarded as failed studies."
    },
    {
      "id": "E11",
      "title": "Empathy manuscript submission and revision",
      "thread": "empathy",
      "date": "2024-06-03",
      "endDate": "2025-04-02",
      "kind": "integration",
      "status": "completed",
      "summary": "The studies were brought together in a manuscript that went through peer review, revision, and resubmission before reaching its final form.",
      "question": "What is the strongest account the full program can support?",
      "significance": "Peer review consolidated the evidence while making boundary conditions part of the final account.",
      "landmark": true
    },
    {
      "id": "E12",
      "title": "Empathy paper accepted and published",
      "thread": "empathy",
      "date": "2025-05-01",
      "endDate": "2025-07-29",
      "kind": "publication",
      "status": "published",
      "summary": "The completed paper, Reward Association With Mental States Shapes Empathy and Prosocial Behavior, was accepted in May 2025 and published online in July.",
      "question": "What did the completed program establish?",
      "significance": "Publication made the learning account and its evidence accessible as a single, durable contribution.",
      "url": "https://doi.org/10.1177/09567976251351304",
      "landmark": true
    },
    {
      "id": "N01",
      "title": "Diffusion of social impressions",
      "thread": "network",
      "date": "2020-05-08",
      "endDate": "2021-02-12",